[{"eventId":1000000001,"eventName":"EventName0","eventGroupId":1000000001,"eventTreePath":[{"eventGroupId":1000000001,"eventGroupName":"Premier League"}],"startDate":"2019-03-14T08:49:54.635+0000","settledDate":"2019-03-14T08:49:54.635+0000","sportId":"Football"},{"eventId":1000000002,"eventName":"EventName1","eventGroupId":1000000001,"eventTreePath":[{"eventGroupId":1000000001,"eventGroupName":"Premier League"}],"startDate":"2019-03-14T08:49:54.635+0000","settledDate":"2019-03-14T08:49:54.635+0000","sportId":"Football"},{"eventId":1000000003,"eventName":"EventName2","eventGroupId":1000000001,"eventTreePath":[{"eventGroupId":1000000001,"eventGroupName":"Premier League"}],"startDate":"2019-03-14T08:49:54.635+0000","settledDate":"2019-03-14T08:49:54.635+0000","sportId":"Football"},{"eventId":1000000004,"eventName":"EventName3","eventGroupId":1000000001,"eventTreePath":[{"eventGroupId":1000000001,"eventGroupName":"Premier League"}],"startDate":"2019-03-14T08:49:54.635+0000","settledDate":"2019-03-14T08:49:54.635+0000","sportId":"Football"},{"eventId":1000000005,"eventName":"EventName4","eventGroupId":1000000001,"eventTreePath":[{"eventGroupId":1000000001,"eventGroupName":"Premier League"}],"startDate":"2019-03-14T08:49:54.635+0000","settledDate":"2019-03-14T08:49:54.635+0000","sportId":"Football"}]